{
  "$schema": "http://json-schema.org/draft-07/schema#",
  "$id": "https://valuechainmodel.schema/profile_manifest.json",
  "title": "ProfileManifest",
  "type": "object",
  "required": ["profile_id", "name", "version", "extends", "lifecycles"],
  "properties": {
    "profile_id": {
      "type": "string",
      "pattern": "^[a-z0-9_]+$"
    },
    "name": {
      "type": "string"
    },
    "industry": {
      "type": "string"
    },
    "version": {
      "type": "string",
      "pattern": "^[0-9]+\\.[0-9]+\\.[0-9]+$"
    },
    "description": {
      "type": "string"
    },
    "extends": {
      "type": "array",
      "items": {
        "type": "string"
      }
    },
    "lifecycles": {
      "type": "array",
      "items": {
        "type": "string"
      },
      "minItems": 1
    },
    "default_lifecycle": {
      "type": "string"
    },
    "apqc_pcf_variant": {
      "type": "string"
    }
  }
}
